{
  "schema": "static-os.crank-turn-request/v0",
  "turn_id": "TURN-PROVIDER-001",
  "source": {
    "kind": "human",
    "id": "fixture:explicit-provider-turn"
  },
  "selected_capability": "AI.PROPOSE",
  "budget_units": 3,
  "authority_request": "none",
  "admission_request": "none",
  "payload": {
    "prompt": "Find the next useful bounded move."
  }
}
